A1: 阶段 | B1: 月份 | D1: KAS/ 每块数量 | E1: KAS/ 每月产出 | F1: 总量 | G1: 阶段数量 | H1: 阶段总数
A2: Pre-deflationary | B2: 1 | C2: 44508 | D2: 500 | E2: =D2*60*60*24*30.4375 -> 1314900000 | F2: =SUM($E$2:E2) -> 1314900000 | G2: =SUM(E2:E7) -> 7889400000 | H2: =SUM(G1:G7) -> 7889400000
B3: 2 | C3: 44538 | D3: 500 | E3: =D3*60*60*24*30.4375 -> 1314900000 | F3: =SUM($E$2:E3) -> 2629800000
B4: 3 | C4: 44569 | D4: 500 | E4: =D4*60*60*24*30.4375 -> 1314900000 | F4: =SUM($E$2:E4) -> 3944700000
B5: 4 | C5: 44600 | D5: 500 | E5: =D5*60*60*24*30.4375 -> 1314900000 | F5: =SUM($E$2:E5) -> 5259600000
B6: 5 | C6: 44628 | D6: 500 | E6: =D6*60*60*24*30.4375 -> 1314900000 | F6: =SUM($E$2:E6) -> 6574500000
B7: 6 | C7: 44659 | D7: 500 | E7: =D7*60*60*24*30.4375 -> 1314900000 | F7: =SUM($E$2:E7) -> 7889400000
A8: 1st year chromatic phase | B8: 7 | C8: 44689 | D8: 440 | E8: =D8*60*60*24*30.4375 -> 1157112000 | F8: =SUM($E$2:E8) -> 9046512000 | G8: =SUM(E8:E19) -> 10308221218.899204 | H8: =SUM(G1:G19) -> 18197621218.899204
B9: 8 | C9: 44720 | D9: =D8*0.943874313 -> 415.30469772000004 | E9: =D9*60*60*24*30.4375 -> 1092168294.0640562 | F9: =SUM($E$2:E9) -> 10138680294.064056
B10: 9 | C10: 44750 | D10: =D9*0.943874313 -> 391.99543624613773 | E10: =D10*60*60*24*30.4375 -> 1030869598.240093 | F10: =SUM($E$2:E10) -> 11169549892.30415
B11: 10 | C11: 44781 | D11: =D10*0.943874313 -> 369.99442308595854 | E11: =D11*60*60*24*30.4375 -> 973011333.8314538 | F11: =SUM($E$2:E11) -> 12142561226.135603
B12: 11 | C12: 44812 | D12: =D11*0.943874313 -> 349.22823190409048 | E12: =D12*60*60*24*30.4375 -> 918400404.26137722 | F12: =SUM($E$2:E12) -> 13060961630.39698
B13: 12 | C13: 44842 | D13: =D12*0.943874313 -> 329.62755746867811 | E13: =D13*60*60*24*30.4375 -> 866854550.63112962 | F13: =SUM($E$2:E13) -> 13927816181.028111
B14: 13 | C14: 44873 | D14: =D13*0.943874313 -> 311.12698435161656 | E14: =D14*60*60*24*30.4375 -> 818201743.44788134 | F14: =SUM($E$2:E14) -> 14746017924.475992
B15: 14 | C15: 44903 | D15: =D14*0.943874313 -> 293.66476861064382 | E15: =D15*60*60*24*30.4375 -> 772279608.4922713 | F15: =SUM($E$2:E15) -> 15518297532.968264
B16: 15 | C16: 44934 | D16: =D15*0.943874313 -> 277.18263172467539 | E16: =D16*60*60*24*30.4375 -> 728934884.90955138 | F16: =SUM($E$2:E16) -> 16247232417.877815
B17: 16 | C17: 44965 | D17: =D16*0.943874313 -> 261.62556609465997 | E17: =D17*60*60*24*30.4375 -> 688022913.71573687 | F17: =SUM($E$2:E17) -> 16935255331.593552
B18: 17 | C18: 44993 | D18: =D17*0.943874313 -> 246.94165146083327 | E18: =D18*60*60*24*30.4375 -> 649407155.01169932 | F18: =SUM($E$2:E18) -> 17584662486.605251
B19: 18 | C19: 45024 | D19: =D18*0.943874313 -> 233.08188162367946 | E19: =D19*60*60*24*30.4375 -> 612958732.29395223 | F19: =SUM($E$2:E19) -> 18197621218.899204
A20: 2nd year chromatic phase | B20: 19 | C20: 45054 | D20: =D19*0.943874313 -> 220.00000089029777 | E20: =D20*60*60*24*30.4375 -> 578556002.34130502 | F20: =SUM($E$2:E20) -> 18776177221.240509 | G20: =SUM(E20:E31) -> 5154110630.3072987 | H20: =SUM(G1:G31) -> 23351731849.206505
B21: 20 | C21: 45085 | D21: =D20*0.943874313 -> 207.65234970032921 | E21: =D21*60*60*24*30.4375 -> 546084149.24192584 | F21: =SUM($E$2:E21) -> 19322261370.482433
B22: 21 | C22: 45115 | D22: =D21*0.943874313 -> 195.99771891623399 | E22: =D22*60*60*24*30.4375 -> 515434801.20591217 | F22: =SUM($E$2:E22) -> 19837696171.688347
B23: 22 | C23: 45146 | D23: =D22*0.943874313 -> 184.99721229162748 | E23: =D23*60*60*24*30.4375 -> 486505668.88452196 | F23: =SUM($E$2:E23) -> 20324201840.572868
B24: 23 | C24: 45177 | D24: =D23*0.943874313 -> 174.61411665867504 | E24: =D24*60*60*24*30.4375 -> 459200203.98898363 | F24: =SUM($E$2:E24) -> 20783402044.561852
B25: 24 | C25: 45207 | D25: =D24*0.943874313 -> 164.81377940130878 | E25: =D25*60*60*24*30.4375 -> 433427277.06956184 | F25: =SUM($E$2:E25) -> 21216829321.631413
B26: 25 | C26: 45238 | D26: =D25*0.943874313 -> 155.56349280534388 | E26: =D26*60*60*24*30.4375 -> 409100873.37949336 | F26: =SUM($E$2:E26) -> 21625930195.010906
B27: 26 | C27: 45268 | D27: =D26*0.943874313 -> 146.83238489952441 | E27: =D27*60*60*24*30.4375 -> 386139805.80876935 | F27: =SUM($E$2:E27) -> 22012070000.819675
B28: 27 | C28: 45299 | D28: =D27*0.943874313 -> 138.59131642319019 | E28: =D28*60*60*24*30.4375 -> 364467443.92970562 | F28: =SUM($E$2:E28) -> 22376537444.749382
B29: 28 | C29: 45330 | D29: =D28*0.943874313 -> 130.81278357670428 | E29: =D29*60*60*24*30.4375 -> 344011458.25001687 | F29: =SUM($E$2:E29) -> 22720548902.999397
B30: 29 | C30: 45359 | D30: =D29*0.943874313 -> 123.47082623007944 | E30: =D30*60*60*24*30.4375 -> 324703578.8198629 | F30: =SUM($E$2:E30) -> 23045252481.81926
B31: 30 | C31: 45390 | D31: =D30*0.943874313 -> 116.54094128345861 | E31: =D31*60*60*24*30.4375 -> 306479367.3872394 | F31: =SUM($E$2:E31) -> 23351731849.206497
A32: 3rd year chromatic phase | B32: 31 | C32: 45420 | D32: =D31*0.943874313 -> 110.00000089029784 | E32: =D32*60*60*24*30.4375 -> 289278002.34130532 | F32: =SUM($E$2:E32) -> 23641009851.547802 | G32: =SUM(E32:E43) -> 2577055325.5824981 | H32: =SUM(G1:G43) -> 25928787174.789001
B33: 32 | C33: 45451 | D33: =D32*0.943874313 -> 103.82617527032926 | E33: =D33*60*60*24*30.4375 -> 273042075.72591192 | F33: =SUM($E$2:E33) -> 23914051927.273712
B34: 33 | C34: 45481 | D34: =D33*0.943874313 -> 97.998859854699617 | E34: =D34*60*60*24*30.4375 -> 257717401.64588904 | F34: =SUM($E$2:E34) -> 24171769328.919601
B35: 34 | C35: 45512 | D35: =D34*0.943874313 -> 92.498606520137884 | E35: =D35*60*60*24*30.4375 -> 243252835.4266586 | F35: =SUM($E$2:E35) -> 24415022164.34626
B36: 35 | C36: 45543 | D36: =D35*0.943874313 -> 87.307058682652467 | E36: =D36*60*60*24*30.4375 -> 229600102.92363945 | F36: =SUM($E$2:E36) -> 24644622267.269901
B37: 36 | C37: 45573 | D37: =D36*0.943874313 -> 82.40689003413928 | E37: =D37*60*60*24*30.4375 -> 216713639.41177946 | F37: =SUM($E$2:E37) -> 24861335906.681683
B38: 37 | C38: 45604 | D38: =D37*0.943874313 -> 77.781746717439759 | E38: =D38*60*60*24*30.4375 -> 204550437.51752305 | F38: =SUM($E$2:E38) -> 25065886344.199207
B39: 38 | C39: 45634 | D39: =D38*0.943874313 -> 73.416192746863459 | E39: =D39*60*60*24*30.4375 -> 193069903.68570152 | F39: =SUM($E$2:E39) -> 25258956247.884911
B40: 39 | C40: 45665 | D40: =D39*0.943874313 -> 69.295658492021332 | E40: =D40*60*60*24*30.4375 -> 182233722.70231768 | F40: =SUM($E$2:E40) -> 25441189970.587227
B41: 40 | C41: 45696 | D41: =D40*0.943874313 -> 65.406392053039255 | E41: =D41*60*60*24*30.4375 -> 172005729.82108265 | F41: =SUM($E$2:E41) -> 25613195700.40831
B42: 41 | C42: 45724 | D42: =D41*0.943874313 -> 61.735413364871086 | E42: =D42*60*60*24*30.4375 -> 162351790.06693798 | F42: =SUM($E$2:E42) -> 25775547490.475246
B43: 42 | C43: 45755 | D43: =D42*0.943874313 -> 58.270470877538713 | E43: =D43*60*60*24*30.4375 -> 153239684.31375131 | F43: =SUM($E$2:E43) -> 25928787174.788998
A44: 4th year chromatic phase | B44: 43 | C44: 45785 | D44: =D43*0.943874313 -> 55.000000667723363 | E44: =D44*60*60*24*30.4375 -> 144639001.75597888 | F44: =SUM($E$2:E44) -> 26073426176.544975 | G44: =SUM(E44:E55) -> 1288527668.0056732 | H44: =SUM(G1:G55) -> 27217314842.794674
B45: 44 | C45: 45816 | D45: =D44*0.943874313 -> 51.913087845246935 | E45: =D45*60*60*24*30.4375 -> 136521038.4154304 | F45: =SUM($E$2:E45) -> 26209947214.960407
B46: 45 | C46: 45846 | D46: =D45*0.943874313 -> 48.999430125641105 | E46: =D46*60*60*24*30.4375 -> 128858701.34441099 | F46: =SUM($E$2:E46) -> 26338805916.304817
B47: 46 | C47: 45877 | D47: =D46*0.943874313 -> 46.249303447231 | E47: =D47*60*60*24*30.4375 -> 121626418.2055281 | F47: =SUM($E$2:E47) -> 26460432334.510345
B48: 47 | C48: 45908 | D48: =D47*0.943874313 -> 43.653529517983692 | E48: =D48*60*60*24*30.4375 -> 114800051.92639352 | F48: =SUM($E$2:E48) -> 26575232386.436741
B49: 48 | C49: 45938 | D49: =D48*0.943874313 -> 41.203445183812079 | E49: =D49*60*60*24*30.4375 -> 108356820.14438902 | F49: =SUM($E$2:E49) -> 26683589206.581131
B50: 49 | C50: 45969 | D50: =D49*0.943874313 -> 38.890873516103788 | E50: =D50*60*60*24*30.4375 -> 102275219.17264974 | F50: =SUM($E$2:E50) -> 26785864425.75378
B51: 50 | C51: 45999 | D51: =D50*0.943874313 -> 36.708096521982355 | E51: =D51*60*60*24*30.4375 -> 96534952.233509198 | F51: =SUM($E$2:E51) -> 26882399377.987289
B52: 51 | C52: 46030 | D52: =D51*0.943874313 -> 34.647829386223783 | E52: =D52*60*60*24*30.4375 -> 91116861.71989131 | F52: =SUM($E$2:E52) -> 26973516239.70718
B53: 52 | C53: 46061 | D53: =D52*0.943874313 -> 32.703196158863186 | E53: =D53*60*60*24*30.4375 -> 86002865.258578405 | F53: =SUM($E$2:E53) -> 27059519104.965759
B54: 53 | C54: 46089 | D54: =D53*0.943874313 -> 30.86770680735123 | E54: =D54*60*60*24*30.4375 -> 81175895.361972257 | F54: =SUM($E$2:E54) -> 27140695000.327732
B55: 54 | C55: 46120 | D55: =D54*0.943874313 -> 29.135235556674065 | E55: =D55*60*60*24*30.4375 -> 76619842.466941461 | F55: =SUM($E$2:E55) -> 27217314842.794674
A56: 5th year chromatic phase | B56: 55 | C56: 46150 | D56: =D55*0.943874313 -> 27.500000445148906 | E56: =D56*60*60*24*30.4375 -> 72319501.170652598 | F56: =SUM($E$2:E56) -> 27289634343.965328 | G56: =SUM(E56:E67) -> 644263836.61004877 | H56: =SUM(G1:G67) -> 27861578679.404724
B57: 56 | C57: 46181 | D57: =D56*0.943874313 -> 25.95654402766462 | E57: =D57*60*60*24*30.4375 -> 68260519.483952418 | F57: =SUM($E$2:E57) -> 27357894863.44928
B58: 57 | C58: 46211 | D58: =D57*0.943874313 -> 24.499715161966197 | E58: =D58*60*60*24*30.4375 -> 64429350.93293871 | F58: =SUM($E$2:E58) -> 27422324214.382217
B59: 58 | C59: 46242 | D59: =D58*0.943874313 -> 23.124651817196529 | E59: =D59*60*60*24*30.4375 -> 60813209.34886343 | F59: =SUM($E$2:E59) -> 27483137423.731079
B60: 59 | C60: 46273 | D60: =D59*0.943874313 -> 21.826764847320575 | E60: =D60*60*60*24*30.4375 -> 57400026.195483647 | F60: =SUM($E$2:E60) -> 27540537449.926563
B61: 60 | C61: 46303 | D61: =D60*0.943874313 -> 20.601722675277259 | E61: =D61*60*60*24*30.4375 -> 54178410.291444145 | F61: =SUM($E$2:E61) -> 27594715860.218006
B62: 61 | C62: 46334 | D62: =D61*0.943874313 -> 19.445436836743845 | E62: =D62*60*60*24*30.4375 -> 51137609.793268964 | F62: =SUM($E$2:E62) -> 27645853470.011276
B63: 62 | C63: 46364 | D63: =D62*0.943874313 -> 18.354048335266491 | E63: =D63*60*60*24*30.4375 -> 48267476.312083811 | F63: =SUM($E$2:E63) -> 27694120946.32336
B64: 63 | C64: 46395 | D64: =D63*0.943874313 -> 17.323914763218454 | E64: =D64*60*60*24*30.4375 -> 45558431.044311889 | F64: =SUM($E$2:E64) -> 27739679377.367672
B65: 64 | C65: 46426 | D65: =D64*0.943874313 -> 16.351598145603376 | E65: =D65*60*60*24*30.4375 -> 43001432.803307757 | F65: =SUM($E$2:E65) -> 27782680810.170979
B66: 65 | C66: 46454 | D66: =D65*0.943874313 -> 15.43385346613346 | E66: =D66*60*60*24*30.4375 -> 40587947.845237777 | F66: =SUM($E$2:E66) -> 27823268758.016216
B67: 66 | C67: 46485 | D67: =D66*0.943874313 -> 14.567617837289388 | E67: =D67*60*60*24*30.4375 -> 38309921.388503633 | F67: =SUM($E$2:E67) -> 27861578679.40472
A68: 6th year chromatic phase | B68: 67 | C68: 46515 | D68: =D67*0.943874313 -> 13.750000278218067 | E68: =D68*60*60*24*30.4375 -> 36159750.73165787 | F68: =SUM($E$2:E68) -> 27897738430.136379 | G68: =SUM(E68:E79) -> 322131919.60863048 | H68: =SUM(G1:G79) -> 28183710599.013355
B69: 68 | C69: 46546 | D69: =D68*0.943874313 -> 12.978272066352888 | E69: =D69*60*60*24*30.4375 -> 34130259.880094826 | F69: =SUM($E$2:E69) -> 27931868690.016476
B70: 69 | C70: 46576 | D70: =D69*0.943874313 -> 12.249857630555923 | E70: =D70*60*60*24*30.4375 -> 32214675.59683596 | F70: =SUM($E$2:E70) -> 27964083365.613312
B71: 70 | C71: 46607 | D71: =D70*0.943874313 -> 11.562325955388779 | E71: =D71*60*60*24*30.4375 -> 30406604.79748141 | F71: =SUM($E$2:E71) -> 27994489970.410793
B72: 71 | C72: 46638 | D72: =D71*0.943874313 -> 10.913382467824652 | E72: =D72*60*60*24*30.4375 -> 28700013.21388527 | F72: =SUM($E$2:E72) -> 28023189983.62468
B73: 72 | C73: 46668 | D73: =D72*0.943874313 -> 10.300861379324239 | E73: =D73*60*60*24*30.4375 -> 27089205.255346887 | F73: =SUM($E$2:E73) -> 28050279188.880028
B74: 73 | C74: 46699 | D74: =D73*0.943874313 -> 9.7227184577178978 | E74: =D74*60*60*24*30.4375 -> 25568805.000106532 | F74: =SUM($E$2:E74) -> 28075847993.880135
B75: 74 | C75: 46729 | D75: =D74*0.943874313 -> 9.1770242047709001 | E75: =D75*60*60*24*30.4375 -> 24133738.253706515 | F75: =SUM($E$2:E75) -> 28099981732.133842
B76: 75 | C76: 46760 | D76: =D75*0.943874313 -> 8.6619574166625046 | E76: =D76*60*60*24*30.4375 -> 22779215.614339054 | F76: =SUM($E$2:E76) -> 28122760947.74818
B77: 76 | C77: 46791 | D77: =D76*0.943874313 -> 8.1757991058875756 | E77: =D77*60*60*24*30.4375 -> 21500716.488663144 | F77: =SUM($E$2:E77) -> 28144261664.236843
B78: 77 | C78: 46820 | D78: =D77*0.943874313 -> 7.7169267642956498 | E78: =D78*60*60*24*30.4375 -> 20293974.004744701 | F78: =SUM($E$2:E78) -> 28164555638.241589
B79: 78 | C79: 46851 | D79: =D78*0.943874313 -> 7.2838089481208694 | E79: =D79*60*60*24*30.4375 -> 19154960.771768264 | F79: =SUM($E$2:E79) -> 28183710599.013355
A80: 7th year chromatic phase | B80: 79 | C80: 46881 | D80: =D79*0.943874313 -> 6.875000166930838 | E80: =D80*60*60*24*30.4375 -> 18079875.438994717 | F80: =SUM($E$2:E80) -> 28201790474.452351 | G80: =SUM(E80:E91) -> 161065960.4561182 | H80: =SUM(G1:G91) -> 28344776559.469475
B81: 80 | C81: 46912 | D81: =D80*0.943874313 -> 6.4891360594367304 | E81: =D81*60*60*24*30.4375 -> 17065130.009106714 | F81: =SUM($E$2:E81) -> 28218855604.461456
B82: 81 | C82: 46942 | D82: =D81*0.943874313 -> 6.1249288400643715 | E82: =D82*60*60*24*30.4375 -> 16107337.863601286 | F82: =SUM($E$2:E82) -> 28234962942.325058
B83: 82 | C83: 46973 | D83: =D82*0.943874313 -> 5.781163001089646 | E83: =D83*60*60*24*30.4375 -> 15203302.460265549 | F83: =SUM($E$2:E83) -> 28250166244.785324
B84: 83 | C84: 47004 | D84: =D83*0.943874313 -> 5.4566912559945076 | E84: =D84*60*60*24*30.4375 -> 14350006.665014355 | F84: =SUM($E$2:E84) -> 28264516251.45034
B85: 84 | C85: 47034 | D85: =D84*0.943874313 -> 5.1504307105049234 | E85: =D85*60*60*24*30.4375 -> 13544602.682485849 | F85: =SUM($E$2:E85) -> 28278060854.132828
B86: 85 | C86: 47065 | D86: =D85*0.943874313 -> 4.8613592485319366 | E86: =D86*60*60*24*30.4375 -> 12784402.551789284 | F86: =SUM($E$2:E86) -> 28290845256.684616
B87: 86 | C87: 47095 | D87: =D86*0.943874313 -> 4.5885121209542783 | E87: =D87*60*60*24*30.4375 -> 12066869.17568556 | F87: =SUM($E$2:E87) -> 28302912125.860302
B88: 87 | C88: 47126 | D88: =D87*0.943874313 -> 4.330978725857892 | E88: =D88*60*60*24*30.4375 -> 11389607.853261085 | F88: =SUM($E$2:E88) -> 28314301733.713562
B89: 88 | C89: 47157 | D89: =D88*0.943874313 -> 4.0878995694867335 | E89: =D89*60*60*24*30.4375 -> 10750358.287836211 | F89: =SUM($E$2:E89) -> 28325052092.0014
B90: 89 | C90: 47185 | D90: =D89*0.943874313 -> 3.8584633977622866 | E90: =D90*60*60*24*30.4375 -> 10146987.043435261 | F90: =SUM($E$2:E90) -> 28335199079.044834
B91: 90 | C91: 47216 | D91: =D90*0.943874313 -> 3.6419044887985241 | E91: =D91*60*60*24*30.4375 -> 9577480.4246423598 | F91: =SUM($E$2:E91) -> 28344776559.469475
A92: 8th year chromatic phase | B92: 91 | C92: 47246 | D92: =D91*0.943874313 -> 3.4375000973763234 | E92: =D92*60*60*24*30.4375 -> 9039937.7560802549 | F92: =SUM($E$2:E92) -> 28353816497.225555 | G92: =SUM(E92:E103) -> 80532980.553960636 | H92: =SUM(G1:G103) -> 28425309540.023434
B93: 92 | C93: 47277 | D93: =D92*0.943874313 -> 3.2445680428485106 | E93: =D93*60*60*24*30.4375 -> 8532565.0390830133 | F93: =SUM($E$2:E93) -> 28362349062.264637
B94: 93 | C94: 47307 | D94: =D93*0.943874313 -> 3.0624644324253927 | E94: =D94*60*60*24*30.4375 -> 8053668.9643922979 | F94: =SUM($E$2:E94) -> 28370402731.229031
B95: 94 | C95: 47338 | D95: =D94*0.943874313 -> 2.8905815122424525 | E95: =D95*60*60*24*30.4375 -> 7601651.260895201 | F95: =SUM($E$2:E95) -> 28378004382.489925
B96: 95 | C96: 47369 | D96: =D95*0.943874313 -> 2.7283456390383458 | E96: =D96*60*60*24*30.4375 -> 7175003.3615430426 | F96: =SUM($E$2:E96) -> 28385179385.851467
B97: 96 | C97: 47399 | D97: =D96*0.943874313 -> 2.5752153656738646 | E97: =D97*60*60*24*30.4375 -> 6772301.3686491288 | F97: =SUM($E$2:E97) -> 28391951687.220116
B98: 97 | C98: 47430 | D98: =D97*0.943874313 -> 2.4306796341024626 | E98: =D98*60*60*24*30.4375 -> 6392201.3017626572 | F98: =SUM($E$2:E98) -> 28398343888.521877
B99: 98 | C99: 47460 | D99: =D98*0.943874313 -> 2.2942560697615533 | E99: =D99*60*60*24*30.4375 -> 6033434.6122589335 | F99: =SUM($E$2:E99) -> 28404377323.134136
B100: 99 | C100: 47491 | D100: =D99*0.943874313 -> 2.1654893716922663 | E100: =D100*60*60*24*30.4375 -> 5694803.9496763218 | F100: =SUM($E$2:E100) -> 28410072127.083813
B101: 100 | C101: 47522 | D101: =D100*0.943874313 -> 2.0439497930148396 | E101: =D101*60*60*24*30.4375 -> 5375179.1656704247 | F101: =SUM($E$2:E101) -> 28415447306.249485
B102: 101 | C102: 47550 | D102: =D101*0.943874313 -> 1.929231706688374 | E102: =D102*60*60*24*30.4375 -> 5073493.5422490863 | F102: =SUM($E$2:E102) -> 28420520799.791733
B103: 102 | C103: 47581 | D103: =D102*0.943874313 -> 1.8209522517683066 | E103: =D103*60*60*24*30.4375 -> 4788740.2317002928 | F103: =SUM($E$2:E103) -> 28425309540.023434
A104: 9th year chromatic phase | B104: 103 | C104: 47611 | D104: =D103*0.943874313 -> 1.7187500556436135 | E104: =D104*60*60*24*30.4375 -> 4519968.8963315748 | F104: =SUM($E$2:E104) -> 28429829508.919765 | G104: =SUM(E104:E115) -> 40266490.439931095 | H104: =SUM(G1:G115) -> 28465576030.463364
B105: 104 | C105: 47642 | D105: =D104*0.943874313 -> 1.6222840279893276 | E105: =D105*60*60*24*30.4375 -> 4266282.5368063347 | F105: =SUM($E$2:E105) -> 28434095791.456573
B106: 105 | C106: 47672 | D106: =D105*0.943874313 -> 1.5312322224092993 | E106: =D106*60*60*24*30.4375 -> 4026834.4984919745 | F106: =SUM($E$2:E106) -> 28438122625.955067
B107: 106 | C107: 47703 | D107: =D106*0.943874313 -> 1.4452907619700406 | E107: =D107*60*60*24*30.4375 -> 3800825.6458288128 | F107: =SUM($E$2:E107) -> 28441923451.600895
B108: 107 | C108: 47734 | D108: =D107*0.943874313 -> 1.3641728250397187 | E108: =D108*60*60*24*30.4375 -> 3587501.6952894521 | F108: =SUM($E$2:E108) -> 28445510953.296185
B109: 108 | C109: 47764 | D109: =D108*0.943874313 -> 1.2876076880476337 | E109: =D109*60*60*24*30.4375 -> 3386150.6980276676 | F109: =SUM($E$2:E109) -> 28448897103.994213
B110: 109 | C110: 47795 | D110: =D109*0.943874313 -> 1.2153398219694787 | E110: =D110*60*60*24*30.4375 -> 3196100.6638153349 | F110: =SUM($E$2:E110) -> 28452093204.658028
B111: 110 | C111: 47825 | D111: =D110*0.943874313 -> 1.1471280395229839 | E111: =D111*60*60*24*30.4375 -> 3016717.3183375434 | F111: =SUM($E$2:E111) -> 28455109921.976364
B112: 111 | C112: 47856 | D112: =D111*0.943874313 -> 1.0827446902277933 | E112: =D112*60*60*24*30.4375 -> 2847401.9863610505 | F112: =SUM($E$2:E112) -> 28457957323.962727
B113: 112 | C113: 47887 | D113: =D112*0.943874313 -> 1.0219749006431562 | E113: =D113*60*60*24*30.4375 -> 2687589.5937113725 | F113: =SUM($E$2:E113) -> 28460644913.556438
B114: 113 | C114: 47915 | D114: =D113*0.943874313 -> 0.9646158572478023 | E114: =D114*60*60*24*30.4375 -> 2536746.7813902707 | F114: =SUM($E$2:E114) -> 28463181660.33783
B115: 114 | C115: 47946 | D115: =D114*0.943874313 -> 0.91047612956867552 | E115: =D115*60*60*24*30.4375 -> 2394370.1255397033 | F115: =SUM($E$2:E115) -> 28465576030.463367